{
    "migrationId": "quick-test-001",
    "sourceMongo": {
        "connectionUri": "mongodb://mongo:27017",
        "database": "shop"
    },
    "targetCrdb": {
        "sqlEndpoint": "postgresql://root@crdb:26257/shop?sslmode=disable"
    },
    "ddl": {
        "mode": "generate_if_missing"
    },
    "snapshot": {
        "enabled": true,
        "avro": {
            "output": {
                "type": "filesystem",
                "basePath": "/tmp/migrate"
            }
        },
        "load": {
            "method": "copy_via_avro"
        }
    },
    "cdc": {
        "enabled": false
    },
    "collections": [
        {
            "name": "orders"
        }
    ]
}